{
  "$schema": "https://json-schema.org/draft/2020-12/schema",
  "title": "MSFS 2024 VR Checklist",
  "description": "Versionable structured checklist data for the native EFB app.",
  "type": "object",
  "additionalProperties": false,
  "required": [
    "schemaVersion",
    "id",
    "title",
    "aircraft",
    "revision",
    "sections"
  ],
  "properties": {
    "schemaVersion": {
      "const": 1
    },
    "id": {
      "$ref": "#/$defs/id"
    },
    "title": {
      "type": "string",
      "minLength": 1
    },
    "aircraft": {
      "type": "object",
      "additionalProperties": false,
      "required": ["manufacturer", "model", "msfsMatches"],
      "properties": {
        "manufacturer": {
          "type": "string",
          "minLength": 1
        },
        "model": {
          "type": "string",
          "minLength": 1
        },
        "msfsMatches": {
          "type": "array",
          "minItems": 1,
          "uniqueItems": true,
          "description": "Explicit MSFS identity rules. Rules are ORed; all fields within one rule must match.",
          "items": {
            "$ref": "#/$defs/aircraftMatch"
          }
        }
      }
    },
    "revision": {
      "type": "string",
      "format": "date"
    },
    "sections": {
      "type": "array",
      "minItems": 1,
      "items": {
        "$ref": "#/$defs/section"
      }
    }
  },
  "$defs": {
    "id": {
      "type": "string",
      "pattern": "^[a-z0-9]+(?:-[a-z0-9]+)*$"
    },
    "aircraftMatch": {
      "type": "object",
      "additionalProperties": false,
      "minProperties": 1,
      "properties": {
        "atcModel": {
          "$ref": "#/$defs/aircraftMatchCriterion"
        },
        "atcType": {
          "$ref": "#/$defs/aircraftMatchCriterion"
        },
        "title": {
          "$ref": "#/$defs/aircraftMatchCriterion"
        }
      }
    },
    "aircraftMatchCriterion": {
      "type": "object",
      "additionalProperties": false,
      "minProperties": 1,
      "maxProperties": 1,
      "properties": {
        "equals": {
          "type": "string",
          "minLength": 1,
          "pattern": "^[^\\r\\n]+$"
        },
        "contains": {
          "type": "string",
          "minLength": 1,
          "pattern": "^[^\\r\\n]+$"
        }
      }
    },
    "section": {
      "type": "object",
      "additionalProperties": false,
      "required": ["id", "title", "phase", "items"],
      "properties": {
        "id": {
          "$ref": "#/$defs/id"
        },
        "title": {
          "type": "string",
          "minLength": 1
        },
        "speechTitle": {
          "type": "string",
          "minLength": 1,
          "pattern": "^[^\\r\\n]+$",
          "description": "Spoken group title in the announcement of the first item, when the visible title would sound wrong."
        },
        "phase": {
          "enum": ["Engine Start", "Taxi", "Departure", "Cruise", "Descent", "Approach", "Landing", "After Landing", "Shutdown"],
          "description": "Flight phase of this group. Engine Start includes preparation; Departure includes takeoff preparation, takeoff and climb."
        },
        "items": {
          "type": "array",
          "minItems": 1,
          "items": {
            "$ref": "#/$defs/item"
          }
        },
        "decision": {
          "type": "string",
          "minLength": 1,
          "pattern": "^[^\\r\\n]+$",
          "description": "Internal maintainer decision behind a deliberate wording, so reviews do not flag it again. Never shown, spoken or exported."
        }
      }
    },
    "item": {
      "type": "object",
      "additionalProperties": false,
      "required": ["id", "challenge", "response", "kind"],
      "properties": {
        "id": {
          "$ref": "#/$defs/id"
        },
        "challenge": {
          "type": "string",
          "minLength": 1,
          "pattern": "^[^\\r\\n]+$"
        },
        "response": {
          "type": "string",
          "minLength": 1,
          "pattern": "^[^\\r\\n]+$"
        },
        "kind": {
          "enum": ["action", "verify", "communication", "optional"]
        },
        "speech": {
          "type": "string",
          "minLength": 1,
          "pattern": "^[^\\r\\n]+$",
          "description": "Optional complete English TTS sentence. If omitted, use challenge followed by response."
        },
        "condition": {
          "type": "string",
          "minLength": 1,
          "pattern": "^[^\\r\\n]+$",
          "description": "Timing or applicability condition for the canonical response; do not repeat it in response."
        },
        "alternatives": {
          "type": "array",
          "minItems": 1,
          "description": "Context-specific responses that replace the canonical response.",
          "items": {
            "$ref": "#/$defs/alternative"
          }
        },
        "notes": {
          "type": "array",
          "minItems": 1,
          "description": "Supplementary display information that is neither a response nor a condition.",
          "items": {
            "type": "string",
            "minLength": 1,
            "pattern": "^[^\\r\\n]+$"
          }
        },
        "needsReview": {
          "type": "boolean"
        },
        "reviewNote": {
          "type": "string",
          "minLength": 1,
          "pattern": "^[^\\r\\n]+$"
        },
        "decision": {
          "type": "string",
          "minLength": 1,
          "pattern": "^[^\\r\\n]+$",
          "description": "Internal maintainer decision behind a deliberate wording, so reviews do not flag it again. Never shown, spoken or exported."
        }
      },
      "allOf": [
        {
          "if": {
            "required": ["needsReview"],
            "properties": {
              "needsReview": {
                "const": true
              }
            }
          },
          "then": {
            "required": ["reviewNote"]
          }
        },
        {
          "if": {
            "required": ["reviewNote"]
          },
          "then": {
            "required": ["needsReview"],
            "properties": {
              "needsReview": {
                "const": true
              }
            }
          }
        }
      ]
    },
    "alternative": {
      "type": "object",
      "additionalProperties": false,
      "required": ["when", "response"],
      "properties": {
        "when": {
          "type": "string",
          "minLength": 1,
          "pattern": "^[^\\r\\n]+$"
        },
        "response": {
          "type": "string",
          "minLength": 1,
          "pattern": "^[^\\r\\n]+$"
        }
      }
    }
  }
}
