{
  "schemaVersion": 1,
  "id": "airbus-h125",
  "title": "Airbus H125",
  "aircraft": {
    "manufacturer": "Airbus Helicopters",
    "model": "H125",
    "msfsMatches": [
      {
        "title": { "contains": "H125" }
      }
    ]
  },
  "revision": "2026-09-19",
  "sections": [
    {
      "id": "before-start",
      "title": "Before Start",
      "phase": "Engine Start",
      "items": [
        {
          "id": "rotor-brake",
          "challenge": "Rotor Brake",
          "response": "Released",
          "kind": "action"
        },
        {
          "id": "twist-grip",
          "challenge": "Twist Grip",
          "response": "IDLE",
          "kind": "action",
          "speech": "Twist grip: Idle."
        },
        {
          "id": "battery-master",
          "challenge": "Battery / Master",
          "response": "On",
          "kind": "action",
          "speech": "Battery and master: On."
        },
        {
          "id": "instrument-lighting",
          "challenge": "Instrument Lighting",
          "response": "Day",
          "kind": "action",
          "alternatives": [
            {
              "when": "Night Flight",
              "response": "Night"
            }
          ],
          "speech": "Instrument lighting: Day. Alternative for a night flight: Night."
        }
      ]
    },
    {
      "id": "engine-start",
      "title": "Engine Start",
      "phase": "Engine Start",
      "items": [
        {
          "id": "fuel-pump-on",
          "challenge": "Fuel Pump",
          "response": "On",
          "kind": "action"
        },
        {
          "id": "anti-collision-light",
          "challenge": "Anti-Collision Light (Beacon)",
          "response": "On",
          "kind": "action"
        },
        {
          "id": "starter-switch",
          "challenge": "Starter Switch",
          "response": "Start",
          "kind": "action"
        },
        {
          "id": "engine-n1",
          "challenge": "Engine N1",
          "response": "≥ 67 %",
          "kind": "verify",
          "speech": "Verify Engine N one: At least 67 percent."
        },
        {
          "id": "generator",
          "challenge": "Generator",
          "response": "On",
          "kind": "action"
        },
        {
          "id": "pitot-heat",
          "challenge": "Pitot Heat",
          "response": "On",
          "kind": "action"
        },
        {
          "id": "fuel-pump",
          "challenge": "Fuel Pump",
          "response": "Off",
          "kind": "action"
        },
        {
          "id": "starter-switch-guard",
          "challenge": "Starter Switch Guard",
          "response": "Close",
          "kind": "action"
        },
        {
          "id": "avionics",
          "challenge": "Avionics",
          "response": "On",
          "kind": "action"
        },
        {
          "id": "twist-grip",
          "challenge": "Twist Grip",
          "response": "IDLE → FLIGHT",
          "kind": "action",
          "speech": "Twist grip: Move from idle to flight."
        },
        {
          "id": "horn",
          "challenge": "Horn",
          "response": "On",
          "kind": "action",
          "condition": "Rotor RPM ≥ 340",
          "speech": "Horn: On when rotor R P M is at least 340."
        }
      ]
    },
    {
      "id": "before-taxi",
      "title": "Before Taxi",
      "phase": "Taxi",
      "items": [
        {
          "id": "taxi-light",
          "challenge": "Taxi Light",
          "response": "On",
          "kind": "action"
        },
        {
          "id": "landing-light",
          "challenge": "Landing Light",
          "response": "As required",
          "kind": "action"
        }
      ]
    },
    {
      "id": "engine-shutdown",
      "title": "Engine Shutdown",
      "phase": "Shutdown",
      "items": [
        {
          "id": "twist-grip",
          "challenge": "Twist Grip",
          "response": "IDLE",
          "kind": "action",
          "speech": "Twist grip: Idle."
        },
        {
          "id": "engine-cool-down",
          "challenge": "Engine Cool-Down",
          "response": "30 s",
          "kind": "action",
          "speech": "Engine cool-down: Wait 30 seconds."
        },
        {
          "id": "pitot-heat",
          "challenge": "Pitot Heat",
          "response": "Off",
          "kind": "action"
        },
        {
          "id": "horn",
          "challenge": "Horn",
          "response": "Off",
          "kind": "action"
        },
        {
          "id": "taxi-light",
          "challenge": "Taxi Light",
          "response": "Off",
          "kind": "action"
        },
        {
          "id": "landing-light",
          "challenge": "Landing Light",
          "response": "Off",
          "kind": "action",
          "condition": "If used",
          "speech": "Landing light: Off, if used."
        },
        {
          "id": "avionics",
          "challenge": "Avionics",
          "response": "Off",
          "kind": "action"
        },
        {
          "id": "starter-switch",
          "challenge": "Starter Switch",
          "response": "Off",
          "kind": "action"
        },
        {
          "id": "generator",
          "challenge": "Generator",
          "response": "Off",
          "kind": "action"
        },
        {
          "id": "rotor-brake",
          "challenge": "Rotor Brake",
          "response": "Apply",
          "kind": "action",
          "condition": "Rotor RPM ≤ 140",
          "speech": "Rotor brake: Apply at 140 rotor R P M or less."
        },
        {
          "id": "anti-collision-light",
          "challenge": "Anti-Collision Light (Beacon)",
          "response": "Off",
          "kind": "action",
          "condition": "Rotor stopped",
          "speech": "Anti-collision light: Off after the rotor has stopped."
        },
        {
          "id": "battery-master",
          "challenge": "Battery / Master",
          "response": "Off",
          "kind": "action",
          "speech": "Battery and master: Off."
        }
      ]
    }
  ]
}
